{
  "$schema": "factory/catalog/schema/component_catalog.schema.json",
  "catalog_id": "application-factory-component-catalog",
  "catalog_schema_version": "1.0.0",
  "derived_from": {
    "canonical_registry": "factory/registry/component_registry.json",
    "registry_id": "application-factory-component-registry",
    "component_contracts_root": "components"
  },
  "components": [
    {
      "component_id": "authorization",
      "component_version": "0.1.0",
      "class": "platform_service",
      "scs_id": null,
      "maturity_level": "level_0_modular_monolith",
      "owner": "@Kvasha62",
      "data_scopes": [
        "platform-scoped",
        "tenant-scoped"
      ],
      "lifecycle": {
        "registry_state": "registered",
        "deployable": false,
        "publishable": false,
        "publishability_blockers": [
          "deployment_artifact_absent",
          "migrations_absent"
        ]
      },
      "contracts": {
        "component_contract": "components/authorization/contract/component_contract.json",
        "openapi": "components/authorization/contract/openapi.yaml"
      },
      "summary": "IS-003 (GitHub Issue #12)",
      "entry_digest": "sha256:7064f0be7f3c1a2fdcfd71d73f996741b18b53cf9705d492bad9f90fc0b730cd"
    },
    {
      "component_id": "identity",
      "component_version": "0.4.0",
      "class": "platform_service",
      "scs_id": null,
      "maturity_level": "level_0_modular_monolith",
      "owner": "@Kvasha62",
      "data_scopes": [
        "platform-scoped",
        "tenant-scoped"
      ],
      "lifecycle": {
        "registry_state": "registered",
        "deployable": false,
        "publishable": false,
        "publishability_blockers": [
          "deployment_artifact_absent",
          "migrations_absent"
        ]
      },
      "contracts": {
        "component_contract": "components/identity/contract/component_contract.json",
        "openapi": "components/identity/contract/openapi.yaml"
      },
      "summary": null,
      "entry_digest": "sha256:098389f18eeda69a45206d96e240e1418287b926a2aa8dd4a3afce8de939273f"
    },
    {
      "component_id": "tenant_authority",
      "component_version": "0.1.0",
      "class": "platform_service",
      "scs_id": null,
      "maturity_level": "level_0_modular_monolith",
      "owner": "@Kvasha62",
      "data_scopes": [
        "platform-scoped"
      ],
      "lifecycle": {
        "registry_state": "registered",
        "deployable": false,
        "publishable": false,
        "publishability_blockers": [
          "deployment_artifact_absent",
          "migrations_absent"
        ]
      },
      "contracts": {
        "component_contract": "components/tenant_authority/contract/component_contract.json",
        "openapi": "components/tenant_authority/contract/openapi.yaml"
      },
      "summary": "IS-002 (GitHub Issue #10)",
      "entry_digest": "sha256:4440c34ec5a3dfc90e14a0370636301caeb0d62fff1553533f7db84c5f591914"
    },
    {
      "component_id": "records",
      "component_version": "0.1.0",
      "class": "platform_service",
      "scs_id": null,
      "maturity_level": "level_0_modular_monolith",
      "owner": "@Kvasha62",
      "data_scopes": [
        "platform-scoped",
        "tenant-scoped"
      ],
      "lifecycle": {
        "registry_state": "registered",
        "deployable": false,
        "publishable": false,
        "publishability_blockers": [
          "deployment_artifact_absent",
          "migrations_absent"
        ]
      },
      "contracts": {
        "component_contract": "components/records/contract/component_contract.json",
        "openapi": "components/records/contract/openapi.yaml"
      },
      "summary": "IS-004 (GitHub Issue #14)",
      "entry_digest": "sha256:00f82e538196f5697175e203980b08527d2ba77514f101ebcc6419a298d44e30"
    },
    {
      "component_id": "learning",
      "component_version": "0.3.0",
      "class": "business_system",
      "scs_id": "SCS-001",
      "maturity_level": "level_0_modular_monolith",
      "owner": "@Kvasha62",
      "data_scopes": [
        "platform-scoped",
        "tenant-scoped"
      ],
      "lifecycle": {
        "registry_state": "registered",
        "deployable": false,
        "publishable": false,
        "publishability_blockers": [
          "deployment_artifact_absent",
          "migrations_absent"
        ]
      },
      "contracts": {
        "component_contract": "components/learning/contract/component_contract.json",
        "openapi": "components/learning/contract/openapi.yaml"
      },
      "summary": "SCS-001 Slices 1-4 — Submission Read, Teacher Submission Discovery (Issue #20), Teacher Submission Review (Issue #24), Learning Content Authoring (Issue #31), Student Enrollment (ADR-0012)",
      "entry_digest": "sha256:83cf435bf038b467aa507d12c66d19833828442c2c024ee3495447070afdd4e7"
    },
    {
      "component_id": "saga",
      "component_version": "0.1.0",
      "class": "platform_service",
      "scs_id": null,
      "maturity_level": "level_0_modular_monolith",
      "owner": "@Kvasha62",
      "data_scopes": [
        "platform-scoped",
        "tenant-scoped"
      ],
      "lifecycle": {
        "registry_state": "registered",
        "deployable": false,
        "publishable": false,
        "publishability_blockers": [
          "deployment_artifact_absent",
          "migrations_absent"
        ]
      },
      "contracts": {
        "component_contract": "components/saga/contract/component_contract.json",
        "openapi": null
      },
      "summary": "IS-006 (GitHub Issue #18)",
      "entry_digest": "sha256:bf67edbafd198f58970322ef46959674d4066692da8d9ce909ea08c86cf83d5e"
    },
    {
      "component_id": "idempotency",
      "component_version": "0.1.0",
      "class": "platform_service",
      "scs_id": null,
      "maturity_level": "level_0_modular_monolith",
      "owner": "@Kvasha62",
      "data_scopes": [
        "platform-scoped"
      ],
      "lifecycle": {
        "registry_state": "registered",
        "deployable": false,
        "publishable": false,
        "publishability_blockers": [
          "deployment_artifact_absent",
          "migrations_absent"
        ]
      },
      "contracts": {
        "component_contract": "components/idempotency/contract/component_contract.json",
        "openapi": null
      },
      "summary": "IS-005 (GitHub Issue #16)",
      "entry_digest": "sha256:e2322b16888dc4338c4142c58cc5b597d6394cf6f2a02e8b0d5297a6d9577dd1"
    },
    {
      "component_id": "commerce",
      "component_version": "0.2.0",
      "class": "business_system",
      "scs_id": "SCS-002",
      "maturity_level": "level_0_modular_monolith",
      "owner": "@Kvasha62",
      "data_scopes": [
        "platform-scoped",
        "tenant-scoped"
      ],
      "lifecycle": {
        "registry_state": "registered",
        "deployable": false,
        "publishable": false,
        "publishability_blockers": [
          "deployment_artifact_absent",
          "migrations_absent"
        ]
      },
      "contracts": {
        "component_contract": "components/commerce/contract/component_contract.json",
        "openapi": "components/commerce/contract/openapi.yaml"
      },
      "summary": "SCS-002 Commerce MVP — Stage 3 business logic (Issue #55, ADR-0013): the full commerce contour on the Stage 2 skeleton — catalog (Product → Offer → Price), mutable Cart, checkout as a business command, immutable Order purchase facts with the mutable payment state — behind the same enforcement chain, IS-005 guard, audit journal and published client. Live operations: twelve — create and read one owned Product, define one Offer, set one Price, open/read/mutate one owned Cart, checkout, read one owned Order, record its payment.",
      "entry_digest": "sha256:8a0ce13b5456ab99e78449a68082650d5a802db56882b5c918957aab345a18e0"
    },
    {
      "component_id": "booking",
      "component_version": "0.1.0",
      "class": "business_system",
      "scs_id": "SCS-003",
      "maturity_level": "level_0_modular_monolith",
      "owner": "@Kvasha62",
      "data_scopes": [
        "platform-scoped",
        "tenant-scoped"
      ],
      "lifecycle": {
        "registry_state": "registered",
        "deployable": false,
        "publishable": false,
        "publishability_blockers": [
          "deployment_artifact_absent",
          "migrations_absent"
        ]
      },
      "contracts": {
        "component_contract": "components/booking/contract/component_contract.json",
        "openapi": "components/booking/contract/openapi.yaml"
      },
      "summary": "SCS-003 Booking MVP (Issue #57, ADR-0014): the third Class A Business System of the Application Factory at Level 0. Owns tenant-scoped Resources, their Availability Windows and Reservations behind the same enforcement chain as SCS-001/SCS-002, reuses IS-001 (tenant context), IS-003 (decision), IS-005 (exactly-once commands) and the audit semantics, and proves the no-double-booking invariant atomically under concurrency. Live operations: seven — create and read one owned Resource, declare and list its Availability Windows, create, read and cancel one Reservation.",
      "entry_digest": "sha256:b4953cae19e9fb2cfd7932e4b8ef3f9c6d72d31a0c439b37f45b1b1b256f30c4"
    }
  ]
}
